{
	"_id": 112030,
	"id": "AgentsSacrificialKnife",
	"name": "特工祭刀",
	"description": "利用至冬国优越的技术制造的异形兵器，曾经属于某位资深特工。一般人不经训练，根本无法使用这种奇怪的武具。",
	"source": [
		"合成获得",
		"40级以上愚人众·债务处理人掉落",
		"星尘兑换"
	],
	"rarity": 3,
	"craft": {
		"cost": 50,
		"items": [
			{
				"_id": 112029,
				"id": "HuntersSacrificialKnife",
				"name": "猎兵祭刀",
				"amount": 3
			}
		]
	}
}