{
	"_id": 112090,
	"id": "ForeignSynapse",
	"name": "Sinapsis extrínseca",
	"description": "Tanto el origen como la zona de actividad de estas criaturas tan atípicas se encuentra en Elynas.",
	"source": [
		"Sintetizar",
		"#Obtenido de Protofisuradores (Niv.{NON_BREAK_SPACE}40+)",
		"Canjear Polvo estelar"
	],
	"rarity": 3,
	"craft": {
		"cost": 50,
		"items": [
			{
				"_id": 112089,
				"id": "RiftCore",
				"name": "Núcleo de la fisura",
				"amount": 3
			}
		]
	}
}