{
	"_id": 112090,
	"id": "ForeignSynapse",
	"name": "Foreign Synapse",
	"description": "Bentuk kehidupan aneh ini berasal dari Elynas dan beraktivitas di area situ juga.",
	"source": [
		"Didapatkan melalui Craft",
		"Dijatuhkan oleh Breacher Primus Lv. 40+",
		"Penukaran Stardust"
	],
	"rarity": 3,
	"craft": {
		"cost": 50,
		"items": [
			{
				"_id": 112089,
				"id": "RiftCore",
				"name": "Rift Core",
				"amount": 3
			}
		]
	}
}